State,Year,File No.,Association Name,Address,Nature
 Tamil Nadu,2005,2005061001,Mission For Andaman & Nicobar,"No-72/ S-3, Sri Bhagya Building,Gajapathy Street, Shenoy Nagar,Chennai, Tamilnadu-600030",Social 
 Tamil Nadu,2005,2005062901,Graama Valarnirai (GVN) Trust,"Annavasal Road,Keelakurichi- Post,Pudukkottai District, Tamilnadu-622101",Social 
 Tamil Nadu,2005,2005065801,St. Adrian's Reachout Centre,"Edwin Illam, Light House Streat,Muttom, Nagerkoil,Tamilnadu-629202",Social 
 Tamil Nadu,2005,2005066401,Foundation For Rights of Young Child,"No-3, Ayyavu Street,Ayyavu Colony, Aminjikarai,Chennai, Tamilnadu-600029",Social 
 Tamil Nadu,2005,2005067301,Karadi Cultural Alliance Trust,"3A, Dev Regency, 11 First Main Road,Gandhinagar, Adyar, Chennai,Tamilnadu-600020",Social 
 Tamil Nadu,2005,2005068702,The Sathish Foundation Public Charitable Trust,"No-5,North Street, Fishermen Colony,Mamallapuram, Distt. Kanchipuram,Tamilnadu-603104",Social 
 Tamil Nadu,2005,2005071601,Trust Children,"35-B, Seashore Town,,Panayur, Chennai,Tamilnadu-600119",Social 
 Tamil Nadu,2005,2005015202,Serve The Helpless,"NCUM Building,New College Campus,87, Peters Road, Royalpettah,Chennai, Tamilnadi-600014",Social 
 Tamil Nadu,2005,2005015302,GFT India Charities,"7 & 8, Bharathidasan Salai,Centre Point, 3rd Floor, Contonment,Tiruchirapali, Trichy, Tamilnadu-620001","Educational ,Social "
 Tamil Nadu,2005,2005019301,Coibatore Christian Hospital Trust,"20, Maharani Avenue-IV,Vadavalli, Coimbatore,Tamilnadu-641041",Social 
 Tamil Nadu,2005,2005019402,International Network of Alternative Financial Institutions-India,"New No-65, First Floor,,3rd Street, Harvey Nagar,,Madurai,Tamilnadu-625016","Cultural ,Economic ,Educational ,Social "
 Tamil Nadu,2005,2005019403,International Network of Alternative Financial Institutions-India,"New No-65, First Floor,,3rd Street, Harvey Nagar,,Madurai,Tamilnadu-625016","Cultural ,Economic ,Educational ,Social "
 Tamil Nadu,2005,2005020001,Media Development Foundation,"""Kasturi Centre"" No-2, Anna Salai,Chennai,Tamilnadu-600002",Social 
 Tamil Nadu,2005,2005022201,Women's Path,"6, Vinayagar Koil Street,Erampattu Village, Aniladi,, Villupuram (Dt.), Tamilnadu-",Social 
 Tamil Nadu,2005,2005023201,"HAND IN HAND, Tamilnadu,","No.42, Vandavasi Road,,Near Periyar Nagar,,Little Kanchipuram(Tamilnadu)-631503",Social 
 Tamil Nadu,2005,2005025701,P.A.L.M- 2 Trust,"Montauban Guest House,Etting Road, Udhagamandalam,The Nilgiris, Tamilnadu-643001",Social 
 Tamil Nadu,2005,2005026401,Voice of Nature,"HIG-507/75, TNHB,Thamarai Nagar, Thiruvannamalai,Tamilnadu-606601",Social 
 Tamil Nadu,2005,2005026402,Voice of Nature,"HIG-507/75, TNHB,Thamarai Nagar, Thiruvannamalai,Tamilnadu-606601",Social 
 Tamil Nadu,2005,2005027201,Ladies Circle India Trust,"Old No-69, (New No-80),,N.H. Road, Nungambakkam,Chennai, Tamilnadu-600034",Social 
 Tamil Nadu,2005,2005027202,Ladies Circle India Trust,"Old No-69, (New No-80),,N.H. Road, Nungambakkam,Chennai, Tamilnadu-600034",Social 
 Tamil Nadu,2005,2005028601,The Hope House,"28, 25th East Cross Road,Gandhinagar,Vellore, Tamilnadu-632006",Social 
 Tamil Nadu,2005,2005029201,Rotary Solidarity in SA Fund Charitable Trust,"38, Malony Road,,Thyagaraja Nagar,Chennai, Tamilnadu-600017",Social 
 Tamil Nadu,2005,2005029701,The Shakti Foundation,"# 17, Manikeswari Road,Kilpauk, Chennai,Tamilnadu-600010",Social 
 Tamil Nadu,2005,2005029902,The Goodbooks Trust,"39, Fourth Street, Abhiramapuram,Chennai,Tamilnadu-600018",Social 
 Tamil Nadu,2005,2005030201,Eternal World development Society,"35, Police Station Street,Vikravandi ,Villupuram,Tamilnadu -605652","Cultural ,Economic ,Educational ,Social "
 Tamil Nadu,2005,2005030301,Innovative Microfinance for Poverty  Alleviation & Community Transformation,"16,V O C Main Road,Kodambakkam,Chennai,Tamilnadu-600024",Social 
 Tamil Nadu,2005,2005030302,Innovative Microfinance for Poverty  Alleviation & Community Transformation,"16,V O C Main Road,Kodambakkam,Chennai,Tamilnadu-600024",Social 
 Tamil Nadu,2005,2005030801,Rotary Dist 3230 Tsunami Relief Association,"38, Malony Road,T. Nagar, Chennai,Tamilnadu-600017",Social 
 Tamil Nadu,2005,2005031801,Sunder Serendipity Foundation,"6-G, Century Plaza,560-562, Anna Salai, Teynampet,Chennai, Tamilnadu-600018",Social 
 Tamil Nadu,2005,2005032302,R.I. District - 2980 Tsunami Relief Fund,"19, Venugopal Pillai Street,Chidammbaram, Cuddalore,Tamilnadu-608001",Social 
 Tamil Nadu,2005,2005074801,Federation of Associations For Community Empowerment (FACE),"Ana Runa Building,Sethu Road, Vedaraniyam,Nagapattinam Distt., Tamilnadu-614810",Social 
 Tamil Nadu,2005,2005076501,Children of The World India,"Pudhukuppam Keelputhupet,Villupuram,Tamil Nadu-605014",Social 
 Tamil Nadu,2005,2005077001,Tulir Charitable Trust,"74, EVK Sampath Road,Veppery, Chennai,Tamilnadu-600007",Social 
 Tamil Nadu,2005,2005081501,The Adventure Charitable Trust,"No-1-A/3, North Pradhashnam Road,Near Thinnappa Theatre,Karur, Tamilnadu-639001","Educational ,Social "
 Tamil Nadu,2005,2005084101,Hitapragnya,"C-5, Shanti Apartments,,21, T.T.K. First Cross Road,Alwarpet, Chennai, Tamilnadu-600018","Cultural ,Economic ,Educational ,Social "
 Tamil Nadu,2005,2005085401,Action For Women Education & Rights Trust (AWERT),"Adaiviagam, Sogandu P.O.,Thirukalukundram Taluk,,District- Kancheepuram, Tamilnadu-603405","Economic ,Educational ,Social "
 Tamil Nadu,2005,2005032403,Sisters of the Destitute Health & Education Service Society,"N0-35, M.H. Road,Perambur (N), Chennai,Tamilnadu-600011","Educational ,Social "
 Tamil Nadu,2005,2005035601,Vidyarambam Trust,"# 27, Fifth Street,,Padmanabha Nagar, Adyar,,Chennai, Tamilnadu-600020",Social 
 Tamil Nadu,2005,2005036801,Rural Education Weaker Section Women Organisation (REWWO),"85, C, Narayana Nagar,Pachapatty Main Road,,Salem, Tamilnadu-636015",Social 
 Tamil Nadu,2005,2005040401,"Centre for Plants,People and Ecosystems","5 Santhana Lakshmi Street,Rajeswari  Nagar,Selaiyur,Chennai -600073-",Social 
 Tamil Nadu,2005,2005041302,Vidyothsahi Educational & Charitable Trust,"3/353, 5th Street,Venketeswaranagar,Kottivakkam,Chennai, Tamilnadu-600041",Social 
 Tamil Nadu,2005,2005041701,The Migrant Domestic Workers Trust,"607, Vasu Block, Chitra Avenue,Choolimedu High Road,Chennai, Tamilnadu-600094",Social 
 Tamil Nadu,2005,2005043201,East Cost Developmet Forum,"#79, Ramachandran Street,Vasudevan Nagar, Jafferkhanper,Chennai, Tamilnadu-600083",Social 
 Tamil Nadu,2005,2005044101,Deepa Jothi Trust,"2/383, Old School Street,Y. Othakkadai, Distt.- Madurai,Tamilnadu-625107","Economic ,Educational ,Social "
 Tamil Nadu,2005,2005044803,Nandalala Medical Foundation,"No-2 & 4, Dr. Ranga Road,,Mylapore, Chennai,Tamilnadu-600004",Social 
 Tamil Nadu,2005,2005045601,Sriman N.K. Thirumalachariar National Education Society,"No-21, Dr. Besant Road,,Triplicane, Chennai,Tamilnadu-600005",Social 
 Tamil Nadu,2005,2005045801,Premsagar Foundation,"No. 6-E, 3rd  Cross Street,Ormes Road, Kilpauk,Chennai, Tamilnadu-600010",Social 
 Tamil Nadu,2005,2005049401,South India American Studies Network,"No-8, Mother Teresa Street,New Perungalathur,Chennai, Tamilnadu-600063",Social 
 Tamil Nadu,2005,2005050201,Mahathma Karunai Illam,"E B Colony,Nagercoil,,District-Dindigul,Tamilnadu-624208",Social 
 Tamil Nadu,2005,2005051501,The Tamilnadu Domestic Workers Welfare Trust,"607, 6th Floor, Vasu Block,Chitra Avenue,Choolaimedu High Road,Chennai, Tamilnadu-",Social 
 Uttar Pradesh,2005,2005002702,Society For Guidance & Education to Minorities in India,"15, WAzirganj,Lucknow,Uttrar Pradesh-226018",Social 
 Uttar Pradesh,2005,2005002801,Light Foundation,"H-37, First Floor,Noida,Uttar Pradesh-201301",Social 
 Uttar Pradesh,2005,2005003101,Bundelkhand University,"Kanpur Road,Jhansi,Uttar Pradesh-284128",Social 
 Uttar Pradesh,2005,2005011501,Karna India,"B - 319, Sector B,Mahanagar,,Lucknow  (UP)-226006",Social 
 Uttar Pradesh,2005,2005052301,Tapovan Education Foundation,"18-B, Shipra Sun City,,Indirapuram, Ghaziabad,Uttar Pradesh-201010",Social 
 Uttar Pradesh,2005,2005064801,Jamia Umama-Lil-Banat Al-Islamia,"536/26 Madehganj Sitapur Road,Taran Saha Takiya Lucknow,Uttar Pradesh-",Social 
 Uttar Pradesh,2005,2005072701,Darul Hadith Educational Society,"192, Purwah Abdul Wali Shahpir Gate,Meerut,Uttar Pradesh-","Religious(Muslim) ,Social "
 Uttar Pradesh,2005,2005073001,Vidya Shree Dharmarth Nyas,"6/97, Kedarghat,Varanasi, Uttar Pradesh,-",Social 
 Uttar Pradesh,2005,2005022302,Sri Gajraj Singh Charitable Society,"116, Gulmohar Apartment,,Madan Mohan Malvilaya Marg,Lucknow, Uttar Pradesh-",Social 
 Uttar Pradesh,2005,2005022701,Banaras Hindu University,"BHU Campus,Varanasi,Uttar Pradesh-221005",Social 
 Uttar Pradesh,2005,2005025501,Al- Millat Foundation Trust,"C/o Pradhnji Ara Machine,,Village-Paikramau, P.O.-Behta,,Kursi Road, Lucknow, Uttar Pradesh-226007",Social 
 Uttar Pradesh,2005,2005025502,Al- Millat Foundation Trust,"C/o Pradhnji Ara Machine,,Village-Paikramau, P.O.-Behta,,Kursi Road, Lucknow, Uttar Pradesh-226007",Social 
 Uttar Pradesh,2005,2005075701,Jayaprakash Narayan Memorial Trust,"1654 ATS Green Village,Plot # 1, Expressway, Sector 93-A,,Noida, Uttar Pradesh-201305","Educational ,Social "
 Uttar Pradesh,2005,2005079701,Wat Thai Kusinara Charitable Trust,"Budha Marg,  Kshinagar,Uttar Pradesh,-274403",Social 
 Uttar Pradesh,2005,2005080701,Manav Khidmat Foundation,"Village & P.O. Marufpur,,District-Chandauli,,Uttar Pradesh-",Social 
 Uttar Pradesh,2005,2005037502,Manav Shanti Pratishthan,"Jain Mandir, Gulab Vatika,Loni Road, Delhi, U.P. Border,Ghaziabad, Uttar Pradesh-","Religious(Others) ,Social "
 Uttar Pradesh,2005,2005039101,Al-Imam Charitable Foundation,"Village & Post-Tajpur,Tehsil-Akbarpur,District-Ambedkar Nagar, U.P.-224122",Social 
 Uttar Pradesh,2005,2005040601,Gyan Jyoti Mahila Kalyan Samiti,"63-D/1-A, Stanley Road,,Beli Colony, Allahabad,Uttar Pradesh-211002",Social 
 Uttar Pradesh,2005,2005048401,Bharat Heritage Foundation,"No-22, Sector-14A,Noida,Uttar Pradesh-201301",Social 
 Uttarakhand,2005,2005008204,Purkal Youth Development Society,"Pukal Gaon, P.O. Bhagwanthpur,,Dehradun,,Uttranchal-248009",Educational 
 Uttarakhand,2005,2005008205,Purkal Youth Development Society,"Pukal Gaon, P.O. Bhagwanthpur,,Dehradun,,Uttranchal-248009",Educational 
 Uttarakhand,2005,2005008206,Purkal Youth Development Society,"Pukal Gaon, P.O. Bhagwanthpur,,Dehradun,,Uttranchal-248009",Educational 
 Uttarakhand,2005,2005020301,Himalayan Educational Literacy Project Society,"Dream House, Near Panington,Wood Stock School, Landour Bazar,,Dehradun, Uttrranchal-248179",Social 
 Uttarakhand,2005,2005021801,Himwanti Uttrakhand Samiti,"Mandir Marg, Gopeshwar,District- Chamoli,Uttranchal-246401",Social 
 Uttarakhand,2005,2005029501,Himalaya Water Service Tatha Vikas Avam Paryavaran Sanrakshan Samiti,"Prof H D Bist Principal Functionary,14/35 GB Pant Marg,Haldwani Uttaranchal-263141",Social 
 Uttarakhand,2005,2005074901,Himalayan Organisation For People & Environment,"Village & Post -Kansani,Near Telephone Exchange,District-Almora, Uttranchal-263825",Social 
 Uttarakhand,2005,2005039201,Institute For Development Support,"Near Police Line, Kandoliya Road,Pauri, District-Pauri Garwal,Uttranchal-246001",Social 
 Uttarakhand,2005,2005041801,Sambandh Oragnaisation,"1,  Turner Road, Clement Town,Dehradun, Uttranchal,-248001",Social 
 Uttarakhand,2005,2005043501,Uttranchal Vikas Jyoti Smiti,"Lane No-5, Shahid Gram,,Gomaniwala, Rishikesh,District-Dehradun, Uttranchal-249204",Social 
 Uttarakhand,2005,2005045201,"Society For Uttaranchal Development And Himalayan Action,","Apna Ghar, The Mall- Almora,,Almora District,,Uttaranchal-263601",Social 
 Uttarakhand,2005,2005048701,Kanya Jeewan Dayani Samiti,"44/2, Nirmal Kutir,Mohini Road, Dehradun,Uttranchal-248001",Social 
 Uttarakhand,2005,2005051901,Community Awareness Centre,"Bhirapani, P.O.-Nartola,District-Nainital,Uttranchal-263132",Social 
 West Bengal,2005,2005000501,"Mission of Mercy India,","Flat 2,,2C, Camac Street,,Kolkatta-700016",Social 
 West Bengal,2005,2005000502,"Mission of Mercy India,","Flat 2,,2C, Camac Street,,Kolkatta-700016",Social 
 West Bengal,2005,2005000601,"Navjyoti Welfare Trust,","31/1J Christophor Road,,Kolkatta,West Bengal-700046",Social 
 West Bengal,2005,2005005401,Stars Welfare Society,"47 South Tangra Road,Kolkata,West Bengal-700046",Social 
 West Bengal,2005,2005006401,Anubhav - Kolkata,"P-798 New Alipore,24 Parganas Kolkata,West Bengal-700053",Social 
 West Bengal,2005,2005006701,Mecheda Bhagaban Shree Krishna Math Mission And Yogashram Kendra,"Mechada No1 Mini Market Stall No118,Mecheda Kolaghat Purba Midnapur,West Bengal-721137",Social 
 West Bengal,2005,2005012701,Water For People India,"C/o Ondeo Nalco,20 A Park Street Kolkata,West Bengal-700016",Social 
 West Bengal,2005,2005012801,Siksha Cente For Excellence,"1A/1A Onrait First Lane,P.S. Entally Kolkata,West Bengal-700014",Social 
 West Bengal,2005,2005012902,Christ Mission Ashram,"144 Santoshpur Avenue,Kolkata 24 Parganas (S),West Bengal-700075",Social 
 West Bengal,2005,2005013301,Centre For Studies in International Relations And Develoment,"35 G South Sinthee Road,Kolkata,West bengal-700050",Social 
 West Bengal,2005,2005013401,Subhi Association for Women with Disabilities,"Vill. Subhi PO Aryapara,24 Parganas (S),West Bengal-743377",Social 
 West Bengal,2005,2005058301,Nabadwip Sri Hari Ohm Children Welfare Society,"P.O. Nabadwip Prachin Mayapur,8th Lane Dist: Nadia,West Bengal-741302",Social 
 West Bengal,2005,2005069901,Seva Bikash Public Trust,"86/D C.I.T. Road,P.O. Entally Kolkata,West Bengal-700014",Social 
 West Bengal,2005,2005070401,Bhaktivedanta Institute,"4th Floor Manasi Apartment RC/8,Raghunathpur VIP Road,Kolkata West Bengal-700059",Social 
 West Bengal,2005,2005070501,National Institute of Cholera and Enteric Diseases (NICED),"P33 CIT Road Scheme XM,Beliaghata Kolkata,West Bengal-700010",Social 
 West Bengal,2005,2005018201,Banga Education Society,"49 Lower Range,Kolkata,West Bengal-700019",Social 
 West Bengal,2005,2005021401,Disha Foundation,"119/1B Manoharpukur Road,Kolkata,West Bengal-700026",Social 
 West Bengal,2005,2005023901,Suprava Panchshila Mahila Uddyog Samity,"35 Chuapur Road Kadamtala,Berhampore Murshidabad,West Bengal-742101",Social 
 West Bengal,2005,2005024201,Schools of the World (Kolkata),"38 Golf Club Road,Tollygunge Kolkata,West Bengal-700033",Social 
 West Bengal,2005,2005028301,Inner Wheel Club of Calcutta Midtown,"C/O. Mrs. Sumi Agrawal,52 B, Ballygunge Circular Road,Kolkata West Bengal-700019",Social 
 West Bengal,2005,2005030501,Kalitala Foundation,"7A Hospital Street 2nd Floor,Kolkata,West Bengal-700072",Social 
 West Bengal,2005,2005031401,Chowrenghee Rotary Trust,"12 Darga Road,Kolkata,West Bengal-700017",Social 
 West Bengal,2005,2005074401,Presidency College,"86/1 College Street,Kolkata,West Bengal-700073",Social 
 West Bengal,2005,2005081301,Dristi Dip,"P5/1 Second Street Modern Park,Jadavpur Santoshpur 24 Parganas (S),Kolkata West Bengal-700075",Educational 
 West Bengal,2005,2005085801,Rasulpur Ramakrishna Sevashram,"Vill. Baidyadanga P.O. Rasulpur,Burdwan,West Bengal-713151",Social 
 West Bengal,2005,2005086401,M/S. Calcutta Kids Trust,"51 Bhairab Dutta Lane, Salkia,Howrah,West Bengal-711106",Social 
 West Bengal,2005,2005034701,Institute of Development Studies Kolkata,"1 Reformatory Street,Calcutta University Alipore,Kolkataest Bengal-700027",Social 
 West Bengal,2005,2005034801,Care of Needy Children Rightfully Nurtured (CONC'RN),"UV-2903-C Udayan 105/1,Survey Park Kolkata 24 Parganas (S),West Bengal-700075",Social 
 West Bengal,2005,2005035901,World Harvest Society of India,"650 Rajdanga Main Road,Plot No. GE - 88 Kolkata,West Bengal-700078",Social 
 West Bengal,2005,2005038701,Rotary Club of Calcutta Mega City Trust,"23/38 Gariahat Road,Kolkata,West Bengal-700029",Social 
 West Bengal,2005,2005046801,IDCS - India,"98 Annapurna Apartments,68 Ballygunge Circular Road,Kolkata West Bengal-700016",Social 
 West Bengal,2005,2005047701,Sappho for Equality,"A-13/2 Purbasha Housing Estate,160 Maniktala Main Road,Kolkata West Bengal-700054",Social 
 West Bengal,2005,2005048101,DEER FOUNDATION (Development Education & Action For Relief),"Room No-1, 1st Floor,R.R. Complex, Vayalur Road,Trichy, Tamilnadu-620017","Cultural ,Economic ,Educational ,Social "
 West Bengal,2005,2005048301,Kalimpong Gaden Tharpa Choling Monastery Non-Profitable Development Association Tripai Bazar,"Kalimpong,Darjeeling,West Bengal-734301","Religious(Buddhist) ,Social "
 West Bengal,2005,2005049601,Change Initiatives,"GC-79 Salt Lake City Sector-3,24 Parganas (N) Kolkata,West Bengal-700106",Social 
 West Bengal,2005,2005049602,Change Initiatives,"GC-79 Salt Lake City Sector-3,24 Parganas (N) Kolkata,West Bengal-700106",Social 
 Andaman & Nicobar Islands,2004,2004032301,Babuji James Educational And Development Trusti,"Thiremalai Ashram -2Chunkankadai,Nagercoil Kanyakumari,Tamil Nadu-629807",Social 
 Andhra Pradesh,2004,2004026001,Rotary Madanapalle-Mid Town,"C/o R.M.N. Reddy & Co.,I-605, Patel Road, Madanapalle,Chittoor District, A.P.-517325",Social 
 Andhra Pradesh,2004,2004029501,Villages in Development & Learning Foundation (VIDAL),"3-6-185/1, #303, Hyderguda,Hyderabad,Andhra Pradesh-500029",Social 
 Andhra Pradesh,2004,2004030801,Permaculture Association of India,"Flat No-601, H.No-1-11-242/1.,Kishan Residency, Strret No-5,,Begumpet, Hyderbad, Andhra Pradesh-500016",Social 
 Andhra Pradesh,2004,2004031601,Federation of Farmers Association,"Flat No-208, Vijaya Towers,,Shanthinagar, Hyderabad,,Andhra Pradesh-500028","Educational ,Social "
 Andhra Pradesh,2004,2004035901,Christ Gospel Church Association,"3-16B-58, Postal Colony,Kakinada, East Godavari,-533003",Social 
 Andhra Pradesh,2004,2004037701,Nalgonda District Sheep Breeders Cooperative Union Ltd.,"5-7-320, Miryalaguda Road,,Nalgonda,,Andhra Pradesh-508001",Social 
 Andhra Pradesh,2004,2004000201,St. Paul's Development Society,"13-120/2, Sanjay Nagar,,Malkajigiri, Hyderabad,Andhra Pradesh-500047","Economic ,Educational ,Social "
 Andhra Pradesh,2004,2004002501,Kushi Development Society,"D.No-1-14, Teachers Colony Road,,Pappireddy Palle Panchayat,,Mandanapalle Mandal, Chittoor, A.P.-517325",Educational 
 Andhra Pradesh,2004,2004043001,"Ananda Bharathi,","12-13-1173, Street No. 10, Tarnaka,,Secunderabad, Hyderabad District,,Andhra Pradesh-500017",Social 
 Andhra Pradesh,2004,2004045801,"The Islamic Thought And Science Trust,","M.No.16-11-15/3/1,Saleemnagar,,Hyderabad(A.P.),-500036",Social 
 Andhra Pradesh,2004,2004047401,"Society for Human Science & Service,","35 Daspallla Hills,,Visakhapatnam(A.P.),-530003",Social 
 Andhra Pradesh,2004,2004052301,"Centre For People's Forestry- CPF,","H.No.12-13-445, Street No.1,Tarnaka,Secunderabad,Distt.Hyderabad(Andhra Pradesh)-500017",Social 
 Andhra Pradesh,2004,2004056901,Cardiac Research And Education Foundation,"Door No-6-3-248/2, Road No-1,Banjara Hills,Hyderabad,Andhra Pradesh-500034",Social 
 Andhra Pradesh,2004,2004010701,Sanghamitra,"Vasant Kunj, Plot No : 3 & 4 A,,Bank Colony, Jeedimetla.,Hyderabad, Andhra Pradesh-500055",Social 
 Andhra Pradesh,2004,2004011201,ASHISH,"25, Surya Enclave,,Trimulgherry, Secunderabad,,Andhra Pradesh-500015",Social 
 Andhra Pradesh,2004,2004011202,ASHISH,"25, Surya Enclave,,Trimulgherry, Secunderabad,,Andhra Pradesh-500015",Social 
 Andhra Pradesh,2004,2004013701,Shaheen Women's Resources & Welfare Association,"23-3-540, Bakshi Bazar,,Sultan Shahi, Hyderabad,,Andhra Pradesh-500065",Social 
 Andhra Pradesh,2004,2004021702,Participatory Rural Development Initiatives Society,"3-6-65/1/7, Baseerbagh,,Hyderabad,Andhra Pradesh-500029",Social 
 Andhra Pradesh,2004,2004022002,Phanendra Chunduri Memorial Trust,"601, Sai Balaji Towers,6-3-563/C, Erramanzil,,Hyderabad, Andhra Pradesh-500082",Social 
 Andhra Pradesh,2004,2004066601,Society of the Church of God of Prophecy,"MIG -18/A, Pitapuram Vuda Colony,Vishkhapatnam,Andhra Pradesh-630003","Religious(Christian) ,Social "
 Andhra Pradesh,2004,2004067701,"Centre for Research on Innovation and Science Policy (CRISP),","C/o ICRISAT),Patancheru,,Medak,,Andhra Pradesh-502324",Social 
 Andhra Pradesh,2004,2004067801,"SaciWATERs,","Plot No.70-Phase:III,,Kamalapuri Colony,Hyderabad(Andhra Pradesh)-500073",Social 
 Andhra Pradesh,2004,2004070901,"Redemption Charitable Society,","Dr.No: 1-10, Chebrolu, Unguturu,Mandal, Chebrolu,,West Godavari(Andhra Pradesh)-534406",Social 
 Andhra Pradesh,2004,2004074001,Fellowship of Curch of God,"T.P. Gudur Village & Mandal,Nellore District,Andhra Pradesh-","Religious(Christian) ,Social "
 Andhra Pradesh,2004,2004078501,"Nava Kanthi,","30/13, Railpet,Machilipatnam,,Krishna District,,Andhra Pradesh-521001",Social 
 Andhra Pradesh,2004,2004079001,"Cerana Foundation,","E-303, Highrise Apartments,,1-3-1024/8,Lower Tank Bund Road,Hyderabad(Andhra Pradesh)-500080",Social 
 Andhra Pradesh,2004,2004080401,"GMR Foundation,","GMR Nagar, Rajam, Srikakulam,,Andhra Pradesh.,-532127",Social 
 Andhra Pradesh,2004,2004083701,"Centre for Sustainable Agriculture(CSA),","H.No. 12-13-445, Street No.1,,Tarnaka, Secunderabad,,Andhra  Pradesh-500017",Social 
 Andhra Pradesh,2004,2004086001,"Leprosy Rehabilitation Project,","4-143, Near Railway Over Bridge,,Mangalagiri-522503, Guntur,,Andhra Pradesh-522503",Social 
 Assam,2004,2004071801,Mushroom Development Foundation,"32 Lamb Road Ambari,Guwahati Kamrup,Assam-781001",Social 
 Bihar,2004,2004027501,Tara Helping Education Society,"Hotel Embassy Bodhgaya,Gaya,Bihar-",Social 
 Bihar,2004,2004028901,Rural Institute of Medical Sciences,"At & P.O. Tajpur,Tajpur Samastipur,Bihar-848130",Social 
 Bihar,2004,2004041001,Nari - Gunjan,"Vill & PO Jamsaut,Danapur Patna,Bihar-801503",Social 
 Bihar,2004,2004043601,Symbiosis Charitable Society,"Infront of Jai Prakash Park Gate,Bodhgaya Gaya,Bihar-824231",Social 
 Bihar,2004,2004054701,Bihar Domestic Workers Welfare Trust,"501-B 5th Floor Kulharia Complex,Ashok Raj Path Bankipore Patna,Bihar-800004",Social 
 Bihar,2004,2004085501,Niranjana Public Welfare Trust,"Vill. + P.O. Bakroar,Bodh-Gaya Gaya,Bihar-824231",Social 
 Chandigarh,2004,2004033201,"Satnam Sarab Kalyan Trust,","1078/2, Sector 39-B,,Chandigarh,-160036","Religious(Sikh) ,Social "
 Chandigarh,2004,2004038401,Shri Guru Amardas Charitable Trust,"Kothi No. 519, Sector 10-D,Chandigarh,-160011","Religious(Sikh) ,Social "
 Chandigarh,2004,2004050401,India International EDucation Trust,"# 2122, Sector-15-C,,Chandigarh,-160015",Social 
 Chhattisgarh,2004,2004037201,Prakriti Mahila Vikas Kendra,"Tamaskar Houses,Station Road Durg (C.G.),Chhattisgarh-490011",Social 
 Chhattisgarh,2004,2004056001,Prakriti Mahila Vikas Kendra,"C/oOld Rajnandgaon-Durg-Gramin Bank,Ramadhin Marg, Distt. Rajnandgaon,Rajnandgaon (C.G.) Chhattisgarh-491441",Social 
 Delhi,2004,2004023301,Hazarat Inayat Khan Foundation,"E 83,Abul Fazal Enclave,Okhla,New Delhi-110025",Social 
 Delhi,2004,2004024401,Mitra Technology Foundation,"D-134,Ist Floor,East of Kailash,New Delhi,-110065","Educational ,Social "
 Delhi,2004,2004025101,Vivekananda Resurgence Foundation,"AG-17 Shalimar Bagh,Ring Road,Delhi-110088",Social 
 Delhi,2004,2004026801,EcoSystem-India,"A-44/3 SFS DDA,Saket,New Delhi-110017",Social 
 Delhi,2004,2004026901,Rotary International's India National Polioplus Society,"A - 2/18, Safdarjung Enclave,New Delhi,-110029","Educational ,Social "
 Delhi,2004,2004027001,South Asia Study Centre,"83,DDA,Janta Flats,GTB Enclave,Delhi-110093","Cultural ,Educational ,Social "
 Delhi,2004,2004027301,Asian Pasific Association for the Study of the Liver(APASL),"Room 210,Academic Block,G B Pant Hospital,New Delhi-110002",Social 
 Delhi,2004,2004028101,Nai Umang,"Operation  Office,X-1, Phase-1,Nangloi,Rohtak Road, New Delhi-110041",Educational 
 Delhi,2004,2004028602,Vidya Charitable Hospital( Trust Redg.),"Vidya Charitable Hospital,Y-46 & 47 Janta Market,Nangloi, Delhi-110004",Social 
 Delhi,2004,2004029301,Amba Foundation,"C-76,Bathla Apartments,43 I P Extension,Delhi-110092","Educational ,Social "
 Delhi,2004,2004029601,Quota Club of Sainik Farm,"C630,New Friends Coloney,New Delhi,-110065",Social 
 Delhi,2004,2004029801,Santvana Community,"Bharat Mata Bhawan,Main Road, Karala,Delhi-110081",Social 
 Delhi,2004,2004031401,Vivadi,"E - 4, Maharani Bagh,,New Delhi,-110065","Cultural ,Educational ,Social "
 Delhi,2004,2004032401,Institute For Social Democracy,"33-B/1(3rd Floor)Prateek Market,Munirka, New Delhil,Delhi-110067",Social 
 Delhi,2004,2004032901,"Lady Shri Ram College for Women,","Lajpat Nagar - IV,,New Delhi,-110024",Social 
 Delhi,2004,2004032902,"Lady Shri Ram College for Women,","Lajpat Nagar - IV,,New Delhi,-110024",Social 
 Delhi,2004,2004033601,"Adopt A Mother Foundation,","A - 9/16, Vasant Vihar,,New Delhi,-110057",Social 
 Delhi,2004,2004034301,Francois Xavier Bagnoud India Society,"L-104 & 105, Ground Floor,Lajpat Nagar II, Jal Vihar Road,New Delhi-110024",Social 
 Delhi,2004,2004035101,"Aman Public Charitable Trust,","C - 651, First Floor,,New Friends Colony,,New Delhi-110065",Social 
 Delhi,2004,2004035201,"National Bal Bhavan,","Kotla Road,,New Delhi,-110002",Social 
 Delhi,2004,2004036701,New Friednship & Brotherhood Dialogue Society,"29 (3rd Floor) Aravali Apartments,,Alaknanda,,New Delhi-110019","Cultural ,Educational ,Social "
 Delhi,2004,2004036801,The People Tree Arts Trust,"A-29 Gulmohar Park,New Delhi-110049,-110049",Social 
 Delhi,2004,2004037001,Nihongo Centre,"K-39E Saket,New Delhi-110017,-110017",Social 
 Delhi,2004,2004038301,Tiger Initiative Group for Earth Revival (T.I.G.E.R),"D-396, IInd Floor, Defence Colony,New Delhi,-110024",Social 
 Delhi,2004,2004040501,Animal India Trust,"1644  Bapu Park,Kotla Mubarakpur,New Delhi-110003",Social 
 Delhi,2004,2004040502,Animal India Trust,"1644  Bapu Park,Kotla Mubarakpur,New Delhi-110003",Social 
