State,Year,File No.,Association Name,Address,Nature
 Delhi,2010,2010039901,NATIONAL ASSOCIATION TARGETTING UPLIFTMENT AND REHABILITATION,"W.Z.D.34,STREET NO-4,OLD MHAVEER NAGAR KRISHNA PARK,NEW DELHI,NEW DELHI,Delhi,Delhi-110018","Educational ,Social "
 Delhi,2010,2010040501,SAMAR JUWARIYA WELFARE TRUST,"26-A/20,ZAKIR NAGAR OKHLA,NEW DELHI,Delhi,Delhi-110024",Social 
 Delhi,2010,2010040602,Feminist Approach to Technology Society,"K 83B, 3rd Floor,Lajpat Nagar - II,New Delhi,Delhi,Delhi-110024",Social 
 Delhi,2010,2010040801,CHILDREN INTERNATIONAL INDIA TRUST,"HOUSE NO. 51,  Ist FLOOR, C/o MASTER DHANI RAM, NARELA ROAD, NEAR OLD DISPENSARY, BAWANA,,DELHI,Delhi,Delhi-110039","Educational ,Social "
 Delhi,2010,2010040901,SISTER DOCTORS FORUM OF INDIA,"4435-36, MAKHANLAL STREET, 7 ANSARI ROAD, DARYAGANJ,NEW DELHI,Delhi,Delhi-110002","Educational ,Social "
 Delhi,2010,2010042301,GRAND CIRCLE FOUNDATION INDIA,"8-E, HANSALAYA,  BARAKHAMBA ROAD, CONNAUGHT PLACE,NEW DELHI,Delhi,Delhi-110001","Educational ,Social "
 Delhi,2010,2010043201,CENTRE FOR DEMOCRACY AND SOCIAL ACTION,"D-7, BLOCK C-3, BHIM NAGARI, SAFDARJUNG DEVELOPMENT AREA,NEW DELHI,Delhi,Delhi-110016","Educational ,Social "
 Delhi,2010,2010043802,ASHISH FOUNDATION FOR THE DIFFERENTLY ABLED CHARITABLE TRUST,"F-3, VIKAS PURI,,NEW DELHI,Delhi,Delhi-110018","Educational ,Social "
 Delhi,2010,2010046401,CARE India Solutions For Sustainable Development,"27, Hauz Khas Village,New Delhi,Delhi,Delhi-110016","Economic ,Educational ,Social "
 Delhi,2010,2010047701,Wetlands International South Asia Society Regd,"A-25, 2nd Floor, Defence Colony,New Delhi,Delhi,Delhi-110024",Educational 
 Delhi,2010,2010047801,African Studies Association of India,"Africa Division, SIS, JNU,New Delhi,Delhi,Delhi-110067","Cultural ,Educational "
 Delhi,2010,2010049601,Safe Water Network India,"The Centrum, Room No.- 1, 3rd floor, BTF002, 369-370, Sultan pur, Main M.G. Road,,New Delhi,Delhi,Delhi-110030",Social 
 Delhi,2010,2010051801,Art for Change Foundation Charitable Trust,"House No.177E, Flat No.I-3, Jay Apartments, Ward No.2, Mehrauli,New Delhi,Delhi,Delhi-110030","Cultural ,Social "
 Delhi,2010,2010053102,ROTARY CLUB OF DELHI GARDEN CITY CHARITABLE TRUST,"97 ANAND LOK,NEW DELHI,Delhi,Delhi-110049",Social 
 Delhi,2010,2010053601,The Teamwork Fine Arts Society,"S-349,Panchsheel Park,Delhi,Delhi-110017",Cultural 
 Delhi,2010,2010053602,The Teamwork Fine Arts Society,"S-349,Panchsheel Park,Delhi,Delhi-110017",Cultural 
 Delhi,2010,2010054301,SAMARPAN FOUNDATION,"63 JOR BAGH,DELHI,Delhi,Delhi-110003",Social 
 Delhi,2010,2010055201,CHILD FUTURE WELFARE SAMITI,"115, 2ND FLOOR, BHAGWAN NAGAR,NEW DELHI,Delhi,Delhi-110014",Social 
 Delhi,2010,2010056401,KASHMIRI MEDICAL EMERGENCY AND CHARITABLE TRUST,"B-206 VARDHMAN APPTS MAYUR VIHAR PHASE-1 EXTN,NEW DELHI,Delhi,Delhi-110091",Social 
 Delhi,2010,2010057101,SOFTWARE FREEDOM LAW CENTER,"12, BIRBAL ROAD FIRST FLOOR JANGPURA EXTENSION,NEW DELHI,Delhi,Delhi-110014",Educational 
 Delhi,2010,2010057701,CHILDREACH INTERNATIONAL INDIA,"G3 Delhi Blue Apartments Near Safdarjung Hospital Beside JPN Apex Trauma Centre  Main Ring road,new delhi,Delhi,Delhi-110029","Educational ,Social "
 Delhi,2010,2010058801,UDAAN INDIA FOUNDATION,"B 65 SECOND FLOOR  EAST OF KAILASH,NEW DELHI,Delhi,Delhi-110065",Educational 
 Delhi,2010,2010059301,Medecins Sans Frontieres Holland India,"C106 Defence Colony,New Delhi,Delhi,Delhi-110024",Social 
 Delhi,2010,2010064802,Hope foundation vadodara,"1 north Avenue  IIT Campus  HauzKhas,New Delhi,Delhi,Delhi-110016","Economic ,Educational ,Social "
 Goa,2010,2010037301,GRACE EDUCATIONAL TRUST,"FLAT NO. A2, B-4, VILLA VERDES, ALTO PORVORIM,,BARDEZ,Bardez,Goa-403521",Educational 
 Goa,2010,2010040301,Childs Play India Foundation,"Casa da Moeda, Near Head Post Office,Panaji,Panjim,Goa-403001","Cultural ,Educational "
 Gujarat,2010,2010000101,ARSHA VIDHYA TIRTHA,"51-52, SHIVDARSHAN SOCIETY, GANDEVI ROAD,NAVSARI,Valsad/Bulser/Navasari,Gujarat-396445","Cultural ,Educational "
 Gujarat,2010,2010009503,ALL INDIA INSTITUTE OF DIABETES AND RESEARCH,"SWASTHYA,2,JAY MANGAL SOCIETY,132 FT RING ROAD,NARANPURA,AHMEDABAD,Ahmedabad,Gujarat-380013","Educational ,Social "
 Gujarat,2010,2010013201,"Dr. Jayantilal Chhaganlal Shah and Bhuriben Chhaganlal Raichand Shah Cheritable Trust, Vadodara","8-B, Saimy Society Part 2, Near Panchratna Apprtment, Ellorapark, Subhanpura, Baroda-23,Baroda,Vadodara/Baroda,Gujarat-390023","Religious(Hindu) ,Cultural ,Economic ,Educational ,Social "
 Gujarat,2010,2010016201,FAITH CALVARY EDUCATION TRUST,"NR FLY OVER BRIDGE, DAHEJ BY PASS ROAD, NANDELAV,BHARUCH,Bharuch,Gujarat-392001","Educational ,Social "
 Gujarat,2010,2010016801,SHRI JALARAM SEVA MANDAL,"L-3/27 ANANDNAGAR  NEAR NILKANTH CINEMA,RAJKOT,Rajkot,Gujarat-360002","Educational ,Social "
 Gujarat,2010,2010020801,GOAL FOUNDATION,"B-12, SHYAM SATTADHAR DUPLEX, NR. UMED PARK, OPP. SURSAGAR TOWER, SOLA ROAD, GHATLODIA,AHMEDABAD,Ahmedabad,Gujarat-380061",Social 
 Gujarat,2010,2010022001,Shri Sanket Charitable Trust,"C/o. Dr. J.V. Parikh, Type-I, 1/1, GEB Colony, Thermal Power Station,,Gandhinagar,Gandhinagar,Gujarat-382041","Cultural ,Economic ,Educational ,Social "
 Gujarat,2010,2010057601,Divyajyoti Trust,"mohalla  suthar faliya  village mandvi,surat,Surat/Barddi,Gujarat-394160","Educational ,Social "
 Gujarat,2010,2010062701,CEPT UNIVERSITY,"KASTURBHAI LALBHAI CAMPUS UNIVERSITY ROAD NAVRANGPURA,AHMEDABAD,Ahmedabad,Gujarat-380009",Educational 
 Gujarat,2010,2010067001,Bhakta Patidar Kelvan Madal,"Maneklal Road Nasari,Navsari,Surat/Barddi,Gujarat-396445",Educational 
 Haryana,2010,2010001801,Kargil Saheed Virender Kumar Memorial Samiti,"Village Mohna,Faridabad,Faridabad,Haryana-121004",Social 
 Haryana,2010,2010018701,Prayatna School of Excellence,"H.NO 1120, IFFCO Colony, Sector 17B,Gurgaon,Gurgaon,Haryana-122001",Educational 
 Haryana,2010,2010022901,J.K. Shanti Charitable Society,"H.No. 100, Sector 12,Panchkula,Punchkula,Haryana-134009","Educational ,Social "
 Haryana,2010,2010025501,CHETNA WELFARE SOCIETY,"F- BLOCK, SOHNA ROAD, SANJAY COLONY, SEC- 23,FARIDABAD,Faridabad,Haryana-121005","Educational ,Social "
 Haryana,2010,2010041501,PEL DRUKPA CHARITABLE TRUST,"D-301, SUSHANT ARCADE, SUSHANT LOK-1,GURGOAN,Gurgaon,Haryana-122001",Social 
 Haryana,2010,2010049005,End Poverty,"M 48 South City 1,Gurgaon,Gurgaon,Haryana-122001",Social 
 Himachal Pradesh,2010,2010047401,Tibetan Centre for Conflict Resolution,"Session Road,Dharamsala,Kangra/Dharamshala,Himachal Pradesh-176215",Social 
 Jammu & Kashmir,2010,2010009301,THE BETHEL CHARITABLE TRUST,"H.NO.423,QASIM NAGAR,BAHU FORT,JAMMU,JAMMU,Jammu Tawi,Jammu & Kashmir-180001","Religious(Christian) ,Cultural ,Educational ,Social "
 Jammu & Kashmir,2010,2010058001,SNOW LEOPARD CONSERVANCY INDIA TRUST,"P O BOX 67 SHANGARA HOUSE TUKCHA MAIN ROAD,LEH,Ladhakh,Jammu & Kashmir-194101",Social 
 Karnataka,2010,2010005702,United Way of Bangaluru,"4/1, A.R.R. Comforts, Flat No. 108, 6th Cross Road,Kodihalli,Bangalore,Karnataka-560008",Social 
 Karnataka,2010,2010005703,United Way of Bangaluru,"4-1  A R R  Comforts  Flat No 108  6th Cross Road,Kodihalli,Bangalore,Karnataka-560008",Social 
 Karnataka,2010,2010006101,PRIYADARSHINI WOMENS RURAL AND URBAN EDUCATION SOCIETY,"NO.41, SRI HARI NILAYA, 1ST FLOOR, 2ND CROSS, SPARSHA HOSPITAL ROAD, HENNAGARA GATE, BOMMASANDRA POST, HOSUR ROAD,BANGALORE,Bangalore,Karnataka-560099",Social 
 Karnataka,2010,2010010801,LAKSHMI EDUCATION SOCIETY,"No.31 / 50, 4th Cross, Yellamma Temple Street, Ganganagar,,Bangalore,Bangalore,Karnataka-560032","Educational ,Social "
 Karnataka,2010,2010010901,NATIONAL ENTREPRENEURSHIP NETWORK,"VILLA NO. 2, GROUND FLOOR, REGENT PLACE, NO. 28/2, THUBARAHALLI VILLAGE, RAMAGUNDANAHALLI, VARTHUR MAIN ROAD,BANGALORE,Bangalore,Karnataka-560066",Educational 
 Karnataka,2010,2010011304,Quality Education and Skills Training Alliance,"108, 2nd Main, 6th Cross, Koramangala I Block,Bangalore,Bangalore,Karnataka-560034",Educational 
 Karnataka,2010,2010013301,ACTION FOR MENTAL ILLNESS,"C-358, JALVAYU VIHAR , KAMMANAHALLI MAIN RD., KALYAN NAGARA,BANGALORE,Bangalore,Karnataka-560043",Social 
 Karnataka,2010,2010013303,ACTION FOR MENTAL ILLNESS,"C-358, JALVAYU VIHAR , KAMMANAHALLI MAIN RD., KALYAN NAGARA,BANGALORE,Bangalore,Karnataka-560043",Social 
 Karnataka,2010,2010013801,MindTree Foundation,"Mindtree Ltd,Global Village,RVCE Post,Mysore Road,Bangalore,Bangalore,Karnataka-560059","Educational ,Social "
 Karnataka,2010,2010014501,JEEVADAAN CHARITABLE TRUST,"D NO 6-2, KAIKAMBA, KINNIKAMBLA P. O.,MANGALORE,Dakshina Kannada,Karnataka-574151",Social 
 Karnataka,2010,2010015601,ANBUKANI CHARITABLE TRUST,"No.67, Ramakrishnappa Road,Cox Town,Bangalore,Karnataka-560005","Economic ,Educational ,Social "
 Karnataka,2010,2010022203,SHANTI FOUNDATION INDIA,"138/16, 4th Cross, Byrasandra Main Road, Ist Block, Jayanagar East,Bangalore,Bangalore,Karnataka-560011","Educational ,Social "
 Karnataka,2010,2010022204,SHANTI FOUNDATION INDIA,"138/16, 4th Cross, Byrasandra Main Road, Ist Block, Jayanagar East,Bangalore,Bangalore,Karnataka-560011","Educational ,Social "
 Karnataka,2010,2010022206,SHANTI FOUNDATION INDIA,"138-16 4th Cross Byrasandra Main Road Ist Block Jayanagar East,Bangalore,Bangalore,Karnataka-560011","Educational ,Social "
 Karnataka,2010,2010023301,DIGITAL GREEN TRUST,"FLAT NO.  T4, 4TH FLOOR,  33, RACE COURSE ROAD, SWISS COMPLEX,BANGALORE,Bangalore,Karnataka-560001","Economic ,Educational ,Social "
 Karnataka,2010,2010026001,RURAL DEVELOPMENT INSTITUTE,"NO 1820, 6TH CROSS, JUDICIAL LAYOUT, GKVK PO, YELAHANKA,BANGALORE,Bangalore,Karnataka-560065",Social 
 Karnataka,2010,2010029402,BMC Development Trust,"BMC Alumni Building, BMC Campus, Fort Road,,Bangalore,Bangalore,Karnataka-560002",Economic 
 Karnataka,2010,2010030001,Association of Karnataka Micro Finance Institutions,"Avalahalli, Anjanapura post, JP Nagar 9th phase,Bangalore,Bangalore,Karnataka-560062","Educational ,Social "
 Karnataka,2010,2010031101,OM CHARITY INDIA FOUNDATION,"NO.32/2, IST FLOOR, 5TH MAIN ROAD,CHAMARAJPET,BANGALORE,Bangalore,Karnataka-560018","Religious(Hindu) ,Cultural ,Educational ,Social "
 Karnataka,2010,2010031401,HIPC TRUST,"NO. 143 3RD Main 1st Block Koramangala,Bangalore,Bangalore,Karnataka-560034",Educational 
 Karnataka,2010,2010032201,Centre for Internet and Society,"No. 194, 2nd C Cross, Domlur 2nd stage,Bangalore,Bangalore,Karnataka-560071","Cultural ,Educational ,Social "
 Karnataka,2010,2010032205,Centre for Internet and Society,"No. 194, 2nd C Cross, Domlur 2nd stage,Bangalore,Bangalore,Karnataka-560071","Cultural ,Educational ,Social "
 Karnataka,2010,2010034101,JEEVAN JYOTHI CHARITABLE TRUST,"Nava Jeevan Mission School Compound, Falls Road, Near Dy. S. P. Office, ,Belgaum,Belgaum,Karnataka-591307","Educational ,Social "
 Karnataka,2010,2010034903,University of Agricultural Sciences Dharwad,"krishinagar,Dharwad,Dharwad,Karnataka-580005",Educational 
 Karnataka,2010,2010036001,CHRISTIAN REFORMED FELLOWSHIP OF INDIA,"No.1005, Kacharkanahalli, Hennur Main Road, Lingarajapuram,Bangalore,Bangalore,Karnataka-560084","Religious(Christian) ,Cultural ,Economic ,Educational ,Social "
 Karnataka,2010,2010036101,Mathru Foundation,"GBJ350, HAL East, New Township, Marathhalli Post, Airport Road,Bangalore,Bangalore,Karnataka-560037",Social 
 Karnataka,2010,2010038602,Slum Children and Women Developmen Society ," 26 / 1B, 4th Cross, Mangamma Palya, ,Bommanahalli, Bangalore,Bangalore Rural,Karnataka-560068",Social 
 Karnataka,2010,2010040201,ARUL ERRUKKAM FOUNDATION,"NO. 124, HOPE FARM, OPP. BPL, WHITEFIELD,,BANGALORE,Bangalore,Karnataka-560066","Economic ,Educational ,Social "
 Karnataka,2010,2010041901,TATTVA VIDYAA TEERTHA TRUST,"NO.69, BOMMURU AGRAHAARA VILLAGE, SRIRANGAPATNA TALUK,SRIRANGAPATNA,Mandya,Karnataka-571438","Cultural ,Educational ,Social "
 Karnataka,2010,2010042702,Research Education and Development Foundation,"250 3rd Main 8th Cross Duo Hts Resi Layout Begur Road,Bangalore,Bangalore,Karnataka-560025",Educational 
 Karnataka,2010,2010045201,Prerana Charitable Trust,"2nd Main, 5th Ward, Dr. Rajkumar Nagar, Kanakanapalya,Kolar,Kolar,Karnataka-563101","Cultural ,Economic ,Educational ,Social "
 Karnataka,2010,2010045901,Foundation for the Advancement of Excellence in Education,"Lumen, Prabhanagar, Kankanady Post,,Mangalore,Dakshina Kannada,Karnataka-575002",Educational 
 Karnataka,2010,2010046301,I CREATE INDIA,"36/3, Sumeru, F-6, 4th Main, Vijaynagar Stage II,Bangalore 560 104,Bangalore,Karnataka-560104","Economic ,Social "
 Karnataka,2010,2010046502,VIDYAVARDHAKA SANGHA,"SAYYAJEE RAO ROAD,MYSORE,Mysore,Karnataka-570021",Educational 
 Karnataka,2010,2010049101,ING VYSYA FOUNDATION,"NO.22, ING VYSYA HOUSE, M.G. ROAD,BANGALORE,Bangalore,Karnataka-560001","Educational ,Social "
 Karnataka,2010,2010051001,Parinaam Foundation,"92 Jakkasandra Extension, Sarjapur Main Cross Road, Koramangala 1st Block,,Bangalore,Bangalore,Karnataka-560034","Economic ,Educational ,Social "
 Karnataka,2010,2010051501,Singing Skylarks,"102, Kaveri Residency, 4th Main Road, G M Palya,Bangalore,Bangalore,Karnataka-560075","Cultural ,Educational "
 Karnataka,2010,2010051701,Santhosa Samsara,"No.131, 8th Cross, BDS Nagar, Narayanpura, Kothanur,Bangalore,Bangalore,Karnataka-560077",Social 
 Karnataka,2010,2010055501,ROTARY CLUB OF BELGAUM - INTERNATIONAL SERVICE PROJECTS ASSOCIATION,"292 Agarkar Road Tilakwadi,Belgaum,Belgaum,Karnataka-590006","Economic ,Educational ,Social "
 Karnataka,2010,2010058501,Valmiki Education and Scholarhsip Trust,"506 4th Cross 2nd Stage 3rd Block RMV Extn,Bangalore,Bangalore,Karnataka-560094",Educational 
 Karnataka,2010,2010061401,Moogambigai Charitable and Educatonal Trust,"No 6 Appa Reddy Complex 1st Floor Upstairs of Corporation bank 5th Cross Mysore Road New Guddadahalli,Bangalore,Bangalore,Karnataka-560026",Educational 
 Kerala,2010,2010016901,TRICHUR AYYANTHOLE LIONS CLUB CHARITABLE TRUST,"JENANI NIVAS, CHELAT LANE, SANKARA IYYAR ROAD,THRISSUR,Thrissur (Trichur),Kerala-680004","Educational ,Social "
 Kerala,2010,2010023902,PRIYADARSHINI MAHILA SAMAJAM,"AIWC NEYYATTINKARA BRANCH, VANDANNOOR, RUSSELPURAM P.O,BALARAMAPURAM,Thiruvananthapuram,Kerala-695501",Social 
 Kerala,2010,2010031303,MOTHER HEALTHCARE FOUNDATION,"AP.II/650 New 3/126,Ugrapuram, Areacode,MALAPPURAM DISTRICT,Malappuram,Kerala-673639","Educational ,Social "
 Kerala,2010,2010032501,Navajyothi Charitable Trust,"XII/183, Tharamuttom Building, Paingattoor.P.O., Kulappuram,Eranakulam,Ernakulam,Kerala-685605","Educational ,Social "
 Kerala,2010,2010051901,Calicut Lions Charitable Trust,"Lions Hall, Rajeev Nagar, PO Puthiyara,Calicut,Kozhikode(Calicut),Kerala-673004",Social 
 Kerala,2010,2010065901,OTTAPALAM WELFARE TRUST,"THOTTAKARA,OTTAPALAM,Palakkad(Palghat),Kerala-679102",Social 
 Madhya Pradesh,2010,2010015401,SRIJAN SAMAJ VIKAS SAMITI,"NEAR PLOYTECHIC COLLEGE , RAJEEV COLONY , DEODARA,MANDLA,Mandla,Madhya Pradesh-481661",Social 
 Madhya Pradesh,2010,2010023001,MOHAMMEDIYAH MADHYAMIK SHALA PRABANDHAK COMMITTEE,"NAVAPURA MOHALLA,RAMPURA,Mandsaur,Madhya Pradesh-458118",Educational 
 Madhya Pradesh,2010,2010025301,Education Park,"Education park, Arogya Bhavan, near Jain Temple, Zhirnya Road,Bhikangaon,Khargone,Madhya Pradesh-451331","Economic ,Educational ,Social "
 Madhya Pradesh,2010,2010025302,Education Park,"Education Park Khargone Road Near MaharanaPratap Dhaba Bhikangaon,Bhikangaon,Khargone,Madhya Pradesh-451331","Economic ,Educational ,Social "
 Madhya Pradesh,2010,2010030601,Lions Charitable society,"In Side fort,Sendhwa,Khargone,Madhya Pradesh-451666","Educational ,Social "
 Madhya Pradesh,2010,2010038001,SETU Society for Empowerment and Trade Upliftment of Artisans,"O-6, Site No. 1, City Centre,Gwalior,Gwalior,Madhya Pradesh-474011",Social 
 Madhya Pradesh,2010,2010047201,SHALEM CHURCH OF GOD TRUST,"170 - VEENANAGAR ANNEX,PRIME CITY, SUKHALIYA,Indore,Madhya Pradesh-452010","Religious(Christian) ,Cultural ,Educational ,Social "
 Maharashtra,2010,2010002301,SATYA GYAN FOUNDATION,"BK. NO. 2, FLAT NO. 6, SORAB, BHARUCHA ROAD, COLABA,MUMBAI,Mumbai,Maharashtra-400005","Cultural ,Economic ,Educational ,Social "
 Maharashtra,2010,2010002401,GOWD SARASWAT BRAHMAN SABHA S MEDICAL TRUST,"SHILPI APARTMENT DASTURWADI MMGS  MARG DADAR E,MUMBAI,Mumbai,Maharashtra-400014",Social 
 Maharashtra,2010,2010003101,DNYANVIKAS KHANDESH SHIKSHAN MANDAL,"GANGATARA APT., SHASTRI NAGAR, POKHARAN RD., NO.1,THANE,Thane,Maharashtra-400606","Educational ,Social "
 Maharashtra,2010,2010004002,Atma Education,"82 B Anita B-Hire Marg, Malabar Hill,Mumbai,Mumbai,Maharashtra-400006",Social 
 Maharashtra,2010,2010004601,Kanbs Foundation,"CO 3-32, Sanskruti Phase-II, Thakur Complex, 90 Feet Road, Kandivali East,Mumbai,Mumbai,Maharashtra-400101",Social 
 Maharashtra,2010,2010007901,AKSHAR GYAN CHARITABLE TRUST,"505,HIMALAYA HOUSE ,79,PALTON ROAD,MUMBAI,Mumbai,Maharashtra-400001",Educational 
 Maharashtra,2010,2010008401,SOCIAL ENTREPRENEURS FOUNDATION INDIA,"CANDELAR BUILDING, 4TH FLOOR, 26 ST. JOHN BAPTIST ROAD,,BANDRA - WEST, MUMBAI - 400 050,Mumbai,Maharashtra-400050",Social 
 Maharashtra,2010,2010008601,SOUTH INDIAN EDUCATION SOCIETY,"C/O SARASWATI VIDHYALAYA HIGH SCHOOL AND JUNIOR COLLEGE, SHANKARNAGAR,NAGPUR,Nagpur,Maharashtra-440010",Educational 
 Maharashtra,2010,2010009802,MUMBAI MOBILE  CRECHES,"Abbas  Building, 1st Floor, Merewhether Road,Colaba,,Mumbai,Mumbai,Maharashtra-400001",Social 
 Maharashtra,2010,2010009803,MUMBAI MOBILE  CRECHES,"Abbas  Building, 1st Floor, Merewhether Road,Colaba,,Mumbai,Mumbai,Maharashtra-400001",Social 
 Maharashtra,2010,2010011401,DR ANJALI MORRIS EDUCATION AND HEALTH FOUNDATION,"301, GOPUR APARTMENTS, 1195/7 SHIVAJINAGAR,Pune,Pune,Maharashtra-411005",Educational 
 Maharashtra,2010,2010011601,SAIFEE BURHANI UPLIFTMENT TRUST,"103, C.K. BUILDING, BADRI MAHAL, DR. D. N. ROAD.,MUMBAI,Mumbai,Maharashtra-400001",Social 
 Maharashtra,2010,2010015903,THE CREATOR EDUCATION SOCIETY,"66, SAMTA HOUSING SOCIETY, SAMTA COLONY,KHAMGAON,Buldana,Maharashtra-444303",Educational 
 Maharashtra,2010,2010018901,Sir Jamsetjee Jejeebhoy Parsee Benevolent Institution,"209, Dr Dadabhai Naoroji Road, Fort,,Mumbai,Mumbai,Maharashtra-400001",Educational 
 Maharashtra,2010,2010020601,SHANTI SEVA NIDHI,"A-25MAROL INDUSTRIAL AREA MIDC, ANDHERI E,MUMBAI,Mumbai,Maharashtra-400093","Educational ,Social "
 Maharashtra,2010,2010021901,HEROES AIDS PROJECT,"GODREJ INDUSTRIES LIMITED, PIROJSHA NAGAR, EASTERN EXPRESS HIGHWAY,VIKHROLI EAST,MUMBAI,Greater Bombay,Maharashtra-400079",Social 
 Maharashtra,2010,2010024303,MAZI SAINIK SHIKAHAN ANI SWASTHYA KALYAN SANSTHA,"VILL DIKSAL  POST KOSHANE TALUKA KARJAT DISTRICT RAIGARH,KARJAT,Raigarh,Maharashtra-410201",Educational 
 Maharashtra,2010,2010025401,The OpenTree Foundation,"147/A, Prasad Building, Gokhale Road North, Dadar West,Mumbai,Mumbai,Maharashtra-400028",Social 
 Maharashtra,2010,2010029801,IRFAN FOUNDATION,"BLDG 14   ROOM NO  14 PANTHAKY BAUG ANDHERI E,MUMBAI,Mumbai,Maharashtra-400069",Educational 
 Maharashtra,2010,2010030501,Critical Art And Media Practices CAMP,"8, Punam, 29/30 Union Park, Khar,Mumbai,Mumbai,Maharashtra-400052",Cultural 
 Maharashtra,2010,2010033001,BALAK VRINDA EDUCATION SOCIETY,"NEW CHIKHALWADI, OFF SLEATER ROAD, GRANTROAD WEST,MUMBAI,Mumbai,Maharashtra-400007",Educational 
 Maharashtra,2010,2010033101,Human Touch India,"Bldg. No. 11, Flat No. 14, Chitnavis Layout, Chhindwara Road,Nagpur,Nagpur,Maharashtra-440013","Economic ,Educational ,Social "
 Maharashtra,2010,2010033102,Human Touch India,"Bldg No 11 Flat No 14 Chitnavis Layout Chhindwara Road,Nagpur,Nagpur,Maharashtra-440013","Economic ,Educational ,Social "
 Maharashtra,2010,2010034001,BOMBAY SAPPERS ASSOCIATION,"HEADQUARTERS BOMBAY ENGINEER GROUP AND CENTRE,KIRKEE, PUNE,Pune,Maharashtra-411003",Social 
 Maharashtra,2010,2010034702,"Society for Awareness, Harmony and Equal Rights","G/4/64, Prem Nagar, Janta Colony, Jogeshwari East,Mumbai,Mumbai,Maharashtra-400060","Educational ,Social "
 Maharashtra,2010,2010035502,RASHTRIYA LIFE SAVING SOCIETY INDIA,"8/103 GULMOHAR COTTAGES VIMAN NAGAR,PUNE,Pune,Maharashtra-411014","Educational ,Social "
 Maharashtra,2010,2010037702,IITB-Monash Research Academy,"IITB Powai,Mumbai,Mumbai,Maharashtra-400076","Educational ,Social "
 Maharashtra,2010,2010039201,aarambh,"33-B, Gitanjali, Sector 17, Vashi,Navi MUmbai,Thane,Maharashtra-400703",Educational 
 Maharashtra,2010,2010039401,"VEDHA, VILLAGE EDUCATION OF DEVELOPMENT IN HUMAN ASSOCIATION","PHULE WARD NO.3, BACKSIDE OF ASHIRWAD MANGAL KARYALAYA,TAH, DIST GADCHIROLI,Gadchiroli,Maharashtra-442605","Cultural ,Educational ,Social "
 Maharashtra,2010,2010041101,COLUMBIA GLOBAL CENTER IN INDIA,"11TH FLOOR, EXPRESS TOWERS, NARIMAN POINT,MUMBAI,Mumbai,Maharashtra-400021",Social 
 Maharashtra,2010,2010044301,LIONS ASSOCIATION OF ICHALKARANJI,"LATE BALASAHEB DATYE LIONS BLOOD BANK, 5/468, DATYE MALA,ICHALKARANJI,Kolhapur,Maharashtra-416115",Social 
 Maharashtra,2010,2010047501,ARMMAN,"303B ALPHA MAIN STREET HIRANANDANI GARDENS POWAI,MUMBAI,Mumbai,Maharashtra-400076",Social 
 Maharashtra,2010,2010047601,INTERGROWTH 21ST  STUDY RESEARCH CENTRE  NAGPUR INDIA,"KETKAR HOSPITAL TEMPLE BAZAR ROAD SITABULDI,NAGPUR,Nagpur,Maharashtra-440012",Educational 
 Maharashtra,2010,2010050301,"APANG SEVA KENDRA, SANGLI","C/o Engineers and  Architect Association, Tennis Ground, Gulmohar Colony,Sangli,SANGLI,Sangli,Maharashtra-416416",Social 
 Maharashtra,2010,2010053402,WOCKHARDT FOUNDATION,"WOCKHARDT TOWERS BANDRA KURLA COMPLEX BANDRA EAST,MUMBAI,Mumbai,Maharashtra-400051","Educational ,Social "
 Maharashtra,2010,2010054801,BIOMEDICAL FOUNDATION OF INDIA,"READYMONEY MANSION 3RD FLOOR 43 VEER NARIMAN ROAD,MUMBAI,Mumbai,Maharashtra-400001",Educational 
 Maharashtra,2010,2010055703,Educo,"25A Belvedere Court Sane Guruji Marg Mahalaxmi,Mumbai,Mumbai,Maharashtra-400011",Educational 
 Maharashtra,2010,2010058601,BHAVISHYA ALLIANCE,"BHAVISHYA ALLIANCE DAKSHINA 7th FLOOR PLOT NO 2 SECTOR 11 CBD BELAPUR NAVI MUMBAI  400 614,NAVI MUMBAI,Thane,Maharashtra-400614",Social 
 Maharashtra,2010,2010059401,HEMOPHILIA SOCIETY MUMBAI CHAPTER,"FLAT 205 2ND FLOOR SAI APARTMENT SWARAJYA BHAVAN 64B BHAGWANRAO PARELKAR MARG,MUMBAI,Mumbai,Maharashtra-400012",Social 
 Maharashtra,2010,2010062201,GREENTARA FOUNDATION,"LAXMI TOWNSHIP PHASE1 B001KALAS  VISHRANTWADI,PUNE,Pune,Maharashtra-411015",Social 
 Maharashtra,2010,2010062501,UMMAT EDUCATIONAL AND CHARITABLE TRUST,"S. NO. 40 ASHOKA NEWS L BLDG SHOP NO 26 27 AND 28,KONDHWA KHURD PUNE,Pune,Maharashtra-411048","Educational ,Social "
 Manipur,2010,2010023401,SACSAS ACADEMY,"C/O SURJITKUMAR YUMKHAIBAM, MOIRANG LAMKHAI,MOIRANG,Bishanpur,Manipur-795133","Educational ,Social "
 Meghalaya,2010,2010061701,The Rotary Club of Shillong Trust,"Shillong Club Ltd M G Road,Shillong,East Khasi Hills,Meghalaya-793002",Social 
 Mizoram,2010,2010032301,The Fundamental Baptist Churches Association of Mizoram,"Canteen Square H/No E-55,Aizawl.,Aizawal,Mizoram-796001","Religious(Christian) ,Cultural ,Economic ,Educational ,Social "
 Mizoram,2010,2010046903,Sunshine Society for children,"Directorate of Social Welfare,Aizawl,Aizawal,Mizoram-796012",Social 
 Nagaland,2010,2010025601,COMMUNITY EDUCATIONAL CENTRE SOCIETY,"GRACE COLONY, KUDA - C, NAGARJAN, POST BOX - 443,DIMAPUR,Kohima/Dimapur,Nagaland-797112","Educational ,Social "
 Orissa,2010,2010007501,Sambalpur Public Library,"c/o- A. P. Padhi, Santinagar, Danipali Road, Budharaja,Sambalpur,Sambalpur,Orissa-768004","Cultural ,Educational ,Social "
 Orissa,2010,2010010002,SOCIETY FOR EDUCATION ANIMATION AND RURAL CARE OF HEALTH,"VIKASH NIKETAN,JYOTINAGAR,BOIPARIGUDA,JEYPORE,Koraput,Orissa-764043","Educational ,Social "
 Orissa,2010,2010033701,INDIAN PATIENTS SOCIETY FOR PRIMARY IMMUNODEFICIENCY-IPSPI,"PLOT 3,PHASE 1,ADARSH VIHAR,PATIA,BHUBANESWAR,Khurda,Orissa-751031",Social 
 Orissa,2010,2010042801,Grassroots India,"opposite Collectors Residence,Tulsipur - Cuttack,Cuttack,Orissa-753008",Social 
 Orissa,2010,2010045401,LIVING FARMS,"PLOT NO-1181/2146 RATNAKAR BAG-2 TANKAPANI ROAD,BHUBANESWAR,Khurda,Orissa-751018","Economic ,Social "
 Orissa,2010,2010052501,VISION INDIA FOUNDATION,"C/O- TRILOCHAN NETRALAYA, MISHRA COLONY FATAK SAMBALPUR,SAMBALPUR,Sambalpur,Orissa-768004",Social 
 Orissa,2010,2010059901,LIVING FARMS,"PLOT NO-1181/2146 RATNAKAR BAG-2 TANKAPANI ROAD,BHUBANESWAR,Khurda,Orissa-751018","Economic ,Social "
 Orissa,2010,2010060001,Sneha Abhiyan,"Erasama,Jagatsinghpur,Jagatsinghpur,Orissa-754139","Economic ,Educational ,Social "
 Orissa,2010,2010062301,Alternative Development Initiative with Rural Engagement,"Jahangirabad P O Sisua Salepur,Cuttack,Cuttack,Orissa-754202","Economic ,Educational ,Social "
 Orissa,2010,2010062801,SPANDAN,"39-A Srikhetra Colony,Puri,Puri,Orissa-752002",Social 
 Pondicherry,2010,2010006301,Wherever The Need India Services,"No. 27, Plot No. 4, Kurinji Nagar 4th Cross Street,Lawspet,Pondicherry,Pondicherry-605008","Economic ,Social "
 Pondicherry,2010,2010006304,Wherever The Need India Services,"No  27  Plot No  4  Kurinji Nagar 4th Cross Street,Lawspet,Pondicherry,Pondicherry-605008","Economic ,Social "
 Pondicherry,2010,2010025101,Association for Regional Econimic Development ,"111 and 113, Gingy Salai, ,Pondicherry ,Pondicherry,Pondicherry-605001",Social 
 Punjab,2010,2010016302,HIS HOLINESS SANT BABA NAHAR SINGH JI SUNHERAN WALE CHARITABLE SOCIETY,"A-9, Civil Lines,Bhatinda,Bathinda,Punjab-151001","Cultural ,Economic ,Educational ,Social "
 Punjab,2010,2010020901,F C SONDHI CHARITABLE TRUST,"15 ADARSH NAGAR,JALANDHAR,Jalandhar,Punjab-144008","Educational ,Social "
 Rajasthan,2010,2010008101,AASHITA FOUNDATION,"B-21, TULSI MARG, HANUMAN NAGAR,,JAIPUR,Jaipur,Rajasthan-302021","Cultural ,Educational ,Social "
 Rajasthan,2010,2010017701,The Raven Charitable Trust,"Lakecity Hospital , 21-Fatehpura,Udaipur,Udaipur,Rajasthan-313001","Educational ,Social "
